{
  "schemaVersion": "0.1",
  "profileVersion": "0.1.0",
  "dtcgVersion": "2025.10",
  "formatSchema": "https://designtokens.org/schemas/2025.10/format.json",
  "fileExtension": ".tokens.json",
  "pathGrammar": "<domain>.<tier>.<tier-specific-path>",
  "supportedDTCGTypes": [
    "color",
    "dimension",
    "fontFamily",
    "fontWeight",
    "duration",
    "cubicBezier",
    "number",
    "strokeStyle",
    "border",
    "transition",
    "shadow",
    "gradient",
    "typography"
  ],
  "parser": {
    "port": "TokenParserPort",
    "adapter": "@axiom/token-tooling/terrazzo",
    "package": "@terrazzo/parser",
    "version": "2.4.0",
    "resolveAliases": false,
    "skipLint": true
  }
}
